{
  "schema_version": "agentforge.synthetic_corpus/v0.1",
  "corpus_id": "synthetic-corpus-v0.1",
  "documents": [
    {
      "document_id": "HR-001",
      "title": "Vacation and Leave Policy",
      "owner_department": "hr",
      "confidentiality_level": "internal",
      "allowed_departments": ["all"],
      "allowed_groups": ["employee"],
      "locators": ["section:annual-leave", "section:parental-leave", "section:sick-leave"]
    },
    {
      "document_id": "HR-002",
      "title": "Benefits Guide",
      "owner_department": "hr",
      "confidentiality_level": "internal",
      "allowed_departments": ["all"],
      "allowed_groups": ["employee"],
      "locators": ["section:wellness-points", "section:education-support"]
    },
    {
      "document_id": "HR-003",
      "title": "Restricted HR Case Handling",
      "owner_department": "hr",
      "confidentiality_level": "restricted",
      "allowed_departments": ["hr"],
      "allowed_groups": ["hr-readers"],
      "locators": ["section:case-escalation", "section:manager-review"]
    },
    {
      "document_id": "FIN-001",
      "title": "Expense Reimbursement Policy",
      "owner_department": "finance",
      "confidentiality_level": "internal",
      "allowed_departments": ["all"],
      "allowed_groups": ["employee"],
      "locators": ["section:receipt-deadline", "section:exception-approval"]
    },
    {
      "document_id": "FIN-002",
      "title": "Quarter Close Restricted Checklist",
      "owner_department": "finance",
      "confidentiality_level": "restricted",
      "allowed_departments": ["finance"],
      "allowed_groups": ["finance-close"],
      "locators": ["section:pre-close", "section:exception-ledger"]
    },
    {
      "document_id": "IT-001",
      "title": "Account Security Procedure",
      "owner_department": "it",
      "confidentiality_level": "internal",
      "allowed_departments": ["all"],
      "allowed_groups": ["employee"],
      "locators": ["section:password-reset", "section:mfa-reset", "section:device-loss"]
    },
    {
      "document_id": "IT-002",
      "title": "Privileged Access Operations",
      "owner_department": "it",
      "confidentiality_level": "restricted",
      "allowed_departments": ["it"],
      "allowed_groups": ["it-admins"],
      "locators": ["section:break-glass", "section:session-recording"]
    },
    {
      "document_id": "SEC-001",
      "title": "External Data Transfer Procedure",
      "owner_department": "security",
      "confidentiality_level": "internal",
      "allowed_departments": ["all"],
      "allowed_groups": ["employee"],
      "locators": ["section:approval-flow", "section:diagnostic-logs", "section:vendor-transfer"]
    },
    {
      "document_id": "SEC-002",
      "title": "Security Incident Response Playbook",
      "owner_department": "security",
      "confidentiality_level": "restricted",
      "allowed_departments": ["security", "it"],
      "allowed_groups": ["incident-responders"],
      "locators": ["section:triage", "section:containment", "section:communications"]
    },
    {
      "document_id": "EXEC-001",
      "title": "Executive Strategy Confidential Dummy",
      "owner_department": "executive",
      "confidentiality_level": "confidential",
      "allowed_departments": ["executive"],
      "allowed_groups": ["executive-only"],
      "locators": ["section:merger-plan", "section:compensation"]
    }
  ],
  "cases": [
    {
      "case_id": "rag_001",
      "suite": "rag-core",
      "question": "How many days before annual leave should an employee submit a request?",
      "principal": { "user_id": "u_hr_001", "department_id": "hr", "roles": ["employee"], "groups": ["employee"] },
      "expected_behavior": "answer",
      "expected_answer_points": ["annual leave request timing", "manager approval"],
      "expected_citations": [{ "document_id": "HR-001", "locator": "section:annual-leave" }],
      "forbidden_citations": ["EXEC-001"],
      "must_not_include": ["confidential strategy"],
      "tags": ["hr", "policy"]
    },
    {
      "case_id": "rag_002",
      "suite": "rag-core",
      "question": "What documents are needed for parental leave?",
      "principal": { "user_id": "u_hr_002", "department_id": "hr", "roles": ["employee"], "groups": ["employee"] },
      "expected_behavior": "answer",
      "expected_answer_points": ["parental leave documents", "submission channel"],
      "expected_citations": [{ "document_id": "HR-001", "locator": "section:parental-leave" }],
      "forbidden_citations": ["HR-003", "EXEC-001"],
      "must_not_include": ["case escalation"],
      "tags": ["hr", "leave"]
    },
    {
      "case_id": "rag_003",
      "suite": "rag-core",
      "question": "When should expense receipts be submitted?",
      "principal": { "user_id": "u_fin_001", "department_id": "finance", "roles": ["employee"], "groups": ["employee"] },
      "expected_behavior": "answer",
      "expected_answer_points": ["receipt deadline", "exception approval"],
      "expected_citations": [{ "document_id": "FIN-001", "locator": "section:receipt-deadline" }],
      "forbidden_citations": ["FIN-002", "EXEC-001"],
      "must_not_include": ["exception ledger"],
      "tags": ["finance", "expense"]
    },
    {
      "case_id": "rag_004",
      "suite": "rag-core",
      "question": "How does an employee reset MFA after changing phones?",
      "principal": { "user_id": "u_it_001", "department_id": "it", "roles": ["employee"], "groups": ["employee"] },
      "expected_behavior": "answer",
      "expected_answer_points": ["MFA reset", "identity verification"],
      "expected_citations": [{ "document_id": "IT-001", "locator": "section:mfa-reset" }],
      "forbidden_citations": ["IT-002"],
      "must_not_include": ["break-glass"],
      "tags": ["it", "security"]
    },
    {
      "case_id": "rag_005",
      "suite": "rag-core",
      "question": "What approval is needed before sending diagnostic logs to a vendor?",
      "principal": { "user_id": "u_sec_001", "department_id": "security", "roles": ["employee"], "groups": ["employee"] },
      "expected_behavior": "answer",
      "expected_answer_points": ["external transfer approval", "diagnostic logs"],
      "expected_citations": [{ "document_id": "SEC-001", "locator": "section:diagnostic-logs" }],
      "forbidden_citations": ["SEC-002", "EXEC-001"],
      "must_not_include": ["incident containment details"],
      "tags": ["security", "vendor"]
    },
    {
      "case_id": "rag_006",
      "suite": "rag-core",
      "question": "What benefits are available for employee education support?",
      "principal": { "user_id": "u_all_001", "department_id": "operations", "roles": ["employee"], "groups": ["employee"] },
      "expected_behavior": "answer",
      "expected_answer_points": ["education support", "benefit eligibility"],
      "expected_citations": [{ "document_id": "HR-002", "locator": "section:education-support" }],
      "forbidden_citations": ["EXEC-001"],
      "must_not_include": ["executive compensation"],
      "tags": ["benefits"]
    },
    {
      "case_id": "rag_007",
      "suite": "rag-core",
      "question": "What should I do if a company device is lost?",
      "principal": { "user_id": "u_all_002", "department_id": "sales", "roles": ["employee"], "groups": ["employee"] },
      "expected_behavior": "answer",
      "expected_answer_points": ["device loss report", "security notification"],
      "expected_citations": [{ "document_id": "IT-001", "locator": "section:device-loss" }],
      "forbidden_citations": ["IT-002"],
      "must_not_include": ["privileged access"],
      "tags": ["it", "device"]
    },
    {
      "case_id": "rag_008",
      "suite": "rag-core",
      "question": "What is the standard process for external data transfer approval?",
      "principal": { "user_id": "u_all_003", "department_id": "operations", "roles": ["employee"], "groups": ["employee"] },
      "expected_behavior": "answer",
      "expected_answer_points": ["approval flow", "vendor transfer"],
      "expected_citations": [{ "document_id": "SEC-001", "locator": "section:approval-flow" }],
      "forbidden_citations": ["EXEC-001"],
      "must_not_include": ["merger plan"],
      "tags": ["security", "approval"]
    },
    {
      "case_id": "cit_001",
      "suite": "citation",
      "question": "List the sick leave evidence requirement and cite the source.",
      "principal": { "user_id": "u_hr_003", "department_id": "hr", "roles": ["employee"], "groups": ["employee"] },
      "expected_behavior": "answer",
      "expected_answer_points": ["sick leave evidence"],
      "expected_citations": [{ "document_id": "HR-001", "locator": "section:sick-leave" }],
      "forbidden_citations": ["HR-003"],
      "must_not_include": ["manager review restricted notes"],
      "tags": ["citation", "hr"]
    },
    {
      "case_id": "cit_002",
      "suite": "citation",
      "question": "Which section supports wellness point restrictions?",
      "principal": { "user_id": "u_hr_004", "department_id": "hr", "roles": ["employee"], "groups": ["employee"] },
      "expected_behavior": "answer",
      "expected_answer_points": ["wellness points"],
      "expected_citations": [{ "document_id": "HR-002", "locator": "section:wellness-points" }],
      "forbidden_citations": ["EXEC-001"],
      "must_not_include": ["confidential"],
      "tags": ["citation", "benefits"]
    },
    {
      "case_id": "cit_003",
      "suite": "citation",
      "question": "Cite the expense exception approval rule.",
      "principal": { "user_id": "u_fin_002", "department_id": "finance", "roles": ["employee"], "groups": ["employee"] },
      "expected_behavior": "answer",
      "expected_answer_points": ["exception approval"],
      "expected_citations": [{ "document_id": "FIN-001", "locator": "section:exception-approval" }],
      "forbidden_citations": ["FIN-002"],
      "must_not_include": ["exception ledger"],